{
  "resource": "Posts",
  "resource_explanation": null,
  "http_method": "POST",
  "route": "/posts",
  "description": "Create post",
  "explanation": null,
  "parameters": [
    {
      "scope": "post",
      "name": "description",
      "description": "Post description"
    },
    {
      "scope": "post",
      "name": "photos_attributes",
      "description": "Photos"
    }
  ],
  "response_fields": [

  ],
  "requests": [
    {
      "request_method": "POST",
      "request_path": "/posts",
      "request_body": "{\n  \"post\": {\n    \"description\": \"Nice post\",\n    \"photos_attributes\": [\n      {\n        \"image\": {\n          \"id\": \"5ae4581df8fa19ea027a9766d61e3b94\",\n          \"storage\": \"cache\",\n          \"metadata\": {\n            \"size\": 68393,\n            \"mime_type\": \"image/jpeg\",\n            \"filename\": \"test.jpg\"\n          }\n        }\n      }\n    ]\n  }\n}",
      "request_headers": {
        "Accept": "application/json",
        "Content-Type": "application/json"
      },
      "request_query_parameters": {
      },
      "request_content_type": "application/json",
      "response_status": 200,
      "response_status_text": "OK",
      "response_body": "{\"id\":58,\"author\":{\"username\":\"user46\",\"description\":null,\"first_name\":null,\"followers\":150,\"following\":100,\"job_title\":null,\"last_name\":null,\"profile_photo_url\":null},\"created_at\":\"2021-06-02 08:19:35 UTC\",\"description\":\"Nice post\",\"is_liked\":false,\"likes_count\":0,\"photos\":[{\"id\":1,\"url\":\"http://localhost:9000/images/store/bdd27dd011487d56f2174ac5baad367b.jpg?X-Amz-Algorithm=AWS4-HMAC-SHA256&X-Amz-Credential=minioadmin%2F20210602%2Fus-east-1%2Fs3%2Faws4_request&X-Amz-Date=20210602T081935Z&X-Amz-Expires=900&X-Amz-SignedHeaders=host&X-Amz-Signature=9418a4b5530378423d7f35c14589956457690fd55bf0a40cb622d088c46edce5\"}]}",
      "response_headers": {
        "Content-Type": "application/json; charset=utf-8"
      },
      "response_content_type": "application/json; charset=utf-8",
      "curl": "curl \"http://localhost:3000/posts\" -d '{\n  \"post\": {\n    \"description\": \"Nice post\",\n    \"photos_attributes\": [\n      {\n        \"image\": {\n          \"id\": \"5ae4581df8fa19ea027a9766d61e3b94\",\n          \"storage\": \"cache\",\n          \"metadata\": {\n            \"size\": 68393,\n            \"mime_type\": \"image/jpeg\",\n            \"filename\": \"test.jpg\"\n          }\n        }\n      }\n    ]\n  }\n}' -X POST \\\n\t-H \"Accept: application/json\" \\\n\t-H \"Content-Type: application/json\" \\\n\t-H \"Authorization: Bearer eyJhbGciOiJIUzI1NiJ9.eyJhY2NvdW50X2lkIjo0OH0.dmezEqalyol2gsGI3wqwUtxmoS7v-hTKVola-lyXXSM\" \\\n\t-H \"Host: example.org\" \\\n\t-H \"Cookie: \""
    }
  ]
}